{
  "$schema": "../../schemas/version.schema.json",
  "schemaVersion": 1,
  "version": "v0.3.0",
  "title": "DeliveryGuard harness guidance refresh",
  "documents": [
    {
      "id": "harness-guidance-refresh",
      "type": "product-requirement",
      "title": "DeliveryGuard v0.3.0 harness guidance refresh",
      "ref": "docs/requirements/v0.3.0.md",
      "primary": true
    }
  ],
  "openSpec": {
    "changeId": "deliveryguard-v0-3",
    "path": "openspec/changes/deliveryguard-v0-3",
    "status": "applied"
  },
  "sources": [
    {
      "repositoryId": "deliveryguard",
      "branch": "main",
      "commit": "8e9d1348b90d4888927a6a861157b542dda58274",
      "status": "merged"
    }
  ],
  "acceptance": {
    "status": "passed",
    "evidence": ".deliveryguard/acceptance/v0.3.0/evidence.json",
    "report": "Candidate revision ccd3b20a5695ca514727c190e4d3e26861917a9a passed deterministic skill, media-helper, sensitive-content, package, and clean-initialization validation."
  },
  "deployments": [
    {
      "repositoryId": "deliveryguard",
      "environmentId": "npm",
      "branch": "main",
      "commit": "8e9d1348b90d4888927a6a861157b542dda58274",
      "status": "succeeded",
      "anchor": "https://github.com/wzf1997/delivery-harness/actions/runs/34182902679",
      "recordedAt": "2026-09-08T03:16:26Z"
    }
  ],
  "release": {
    "status": "published",
    "anchor": "https://www.npmjs.com/package/deliveryguard/v/0.3.0",
    "releasedAt": "2026-09-08T03:16:21.345Z"
  }
}
