{
  "$schema": "../../schemas/version.schema.json",
  "schemaVersion": 1,
  "version": "v0.4.0",
  "title": "DeliveryGuard candidate review workflows",
  "documents": [
    {
      "id": "candidate-review-workflows",
      "type": "product-requirement",
      "title": "DeliveryGuard v0.4.0 candidate review workflows",
      "ref": "docs/requirements/v0.4.0.md",
      "primary": true
    }
  ],
  "openSpec": {
    "changeId": "deliveryguard-v0-4",
    "path": "openspec/changes/deliveryguard-v0-4",
    "status": "applied"
  },
  "sources": [
    {
      "repositoryId": "deliveryguard",
      "branch": "codex/deliveryguard-review-workflows",
      "commit": "affc554f2e089f76e24784d5cf2a83899d9be2e3",
      "status": "submitted"
    }
  ],
  "acceptance": {
    "status": "passed",
    "evidence": ".deliveryguard/acceptance/v0.4.0/evidence.json",
    "report": "Candidate affc554f2e089f76e24784d5cf2a83899d9be2e3 passed 76 tests, package installation and public-content validation; see docs/evidence/v0.4.0/candidate-validation.md."
  },
  "deployments": [],
  "release": {
    "status": "pending"
  }
}
