{
  "$schema": "../../schemas/version.schema.json",
  "schemaVersion": 1,
  "version": "v0.2.0",
  "title": "DeliveryGuard diagnosis and real-device skills",
  "documents": [
    {
      "id": "diagnosis-real-device-skills",
      "type": "product-requirement",
      "title": "DeliveryGuard v0.2.0 diagnosis and real-device skills",
      "ref": "docs/requirements/v0.2.0.md",
      "primary": true
    }
  ],
  "openSpec": {
    "changeId": "deliveryguard-v0-2",
    "path": "openspec/changes/deliveryguard-v0-2",
    "status": "ready"
  },
  "sources": [],
  "acceptance": { "status": "pending" },
  "deployments": [],
  "release": { "status": "pending" }
}
